{
  "$schema": "https://json-schema.org/draft/2020-12/schema",
  "$id": "urn:pointr:contracts:session",
  "title": "session.json",
  "description": "DATA_CONTRACTS.md section 2. Missing values are null, never 0.",
  "type": "object",
  "additionalProperties": false,
  "required": [
    "contract_version", "session_id", "device_id", "camera_id", "group_id", "started_at", "ended_at", "status",
    "source", "registration", "recording", "runs", "events", "calibration"
  ],
  "properties": {
    "contract_version": {"type": "string", "pattern": "^(0|[1-9][0-9]*)\\.(0|[1-9][0-9]*)\\.(0|[1-9][0-9]*)$"},
    "session_id": {"$ref": "#/$defs/uuid4"},
    "device_id": {"$ref": "#/$defs/uuid4"},
    "camera_id": {"type": ["string", "null"], "pattern": "^[A-Za-z0-9_-]{1,32}$"},
    "group_id": {"type": ["string", "null"], "pattern": "^[A-Za-z0-9_-]{1,64}$"},
    "started_at": {"$ref": "#/$defs/utc"},
    "ended_at": {"anyOf": [{"$ref": "#/$defs/utc"}, {"type": "null"}]},
    "status": {"enum": ["running", "ended", "interrupted", "error"]},
    "source": {
      "type": "object",
      "additionalProperties": false,
      "required": ["kind", "ref", "width", "height", "reported_fps", "link"],
      "properties": {
        "kind": {"enum": ["camera", "stream", "file"]},
        "ref": {"type": "string", "minLength": 1},
        "width": {"type": ["integer", "null"], "minimum": 1},
        "height": {"type": ["integer", "null"], "minimum": 1},
        "reported_fps": {"type": ["number", "null"], "exclusiveMinimum": 0},
        "link": {"enum": ["usb", "wifi", "builtin", "file", null]}
      },
      "description": "link is file exactly when kind is file, or link is null (D-020)",
      "allOf": [
        {
          "if": {"properties": {"kind": {"const": "file"}}},
          "then": {"properties": {"link": {"enum": ["file", null]}}}
        },
        {
          "if": {"properties": {"link": {"const": "file"}}},
          "then": {"properties": {"kind": {"const": "file"}}}
        }
      ]
    },
    "registration": {
      "type": ["object", "null"],
      "description": "Filled from phase 6; null before that.",
      "additionalProperties": false,
      "required": ["date", "team_ids"],
      "properties": {
        "date": {"type": "string", "pattern": "^\\d{4}-\\d{2}-\\d{2}$"},
        "team_ids": {
          "type": "array",
          "items": {"$ref": "#/$defs/uuid4"},
          "minItems": 1,
          "maxItems": 2,
          "uniqueItems": true
        }
      }
    },
    "recording": {
      "type": "object",
      "additionalProperties": false,
      "required": ["enabled", "path", "sha256", "locked"],
      "properties": {
        "enabled": {"type": "boolean"},
        "path": {"type": ["string", "null"], "minLength": 1},
        "sha256": {"anyOf": [{"$ref": "#/$defs/sha256"}, {"type": "null"}]},
        "locked": {"type": "boolean"}
      }
    },
    "runs": {
      "type": "array",
      "items": {"$ref": "#/$defs/uuid4"},
      "uniqueItems": true
    },
    "calibration": {
      "type": ["object", "null"],
      "additionalProperties": false,
      "required": ["calibration_id", "check_error_m", "court"],
      "properties": {
        "calibration_id": {"$ref": "#/$defs/uuid4"},
        "check_error_m": {"type": "number", "minimum": 0},
        "court": {
          "type": "object",
          "additionalProperties": false,
          "required": ["type", "length_m", "width_m"],
          "properties": {
            "type": {"enum": ["fiba_full", "fiba_half", "custom"]},
            "length_m": {"type": "number", "exclusiveMinimum": 0},
            "width_m": {"type": "number", "exclusiveMinimum": 0}
          }
        }
      }
    },
    "events": {
      "type": "array",
      "items": {
        "type": "object",
        "additionalProperties": false,
        "required": ["t_wall", "t_mono", "kind", "detail"],
        "properties": {
          "t_wall": {"$ref": "#/$defs/utc"},
          "t_mono": {"type": ["number", "null"]},
          "kind": {
            "enum": [
              "source_open_failed", "source_lost", "source_recovered", "frozen_frames",
              "dark_frames", "writer_backlog", "recorder_backlog", "interrupted", "error",
              "camera_gap", "sensor_outage", "startup_check_failed", "rim_drift", "stopped",
              "appearance_only", "replay_order_approximate"
            ]
          },
          "detail": {"type": ["string", "null"]}
        }
      }
    }
  },
  "$defs": {
    "uuid4": {
      "type": "string",
      "pattern": "^[0-9a-f]{8}-[0-9a-f]{4}-4[0-9a-f]{3}-[89ab][0-9a-f]{3}-[0-9a-f]{12}$"
    },
    "utc": {
      "type": "string",
      "pattern": "^\\d{4}-\\d{2}-\\d{2}T\\d{2}:\\d{2}:\\d{2}(\\.\\d+)?Z$"
    },
    "sha256": {"type": "string", "pattern": "^[0-9a-f]{64}$"},
    "matrix3": {
      "type": "array",
      "items": {"type": "array", "items": {"type": "number"}, "minItems": 3, "maxItems": 3},
      "minItems": 3,
      "maxItems": 3
    }
  }
}
