{
  "contract_version": "0.9.0",
  "session_id": "3f1c2a8e-5b7d-4e9a-8c21-6d4f0b9e7a13",
  "device_id": "a7e4d2c1-9f8b-4a6e-b3d5-1c0e2f4a6b8d",
  "camera_id": "cam1",
  "group_id": "8d2f6b1e-4c3a-4e7d-9a5b-0f1e2d3c4b5a",
  "started_at": "2026-10-07T18:00:00Z",
  "ended_at": "2026-10-07T18:01:00Z",
  "status": "ended",
  "source": {"kind": "camera", "ref": "1", "width": 1280, "height": 720, "reported_fps": 30.0,
             "link": "usb"},
  "registration": {"date": "2026-10-07", "team_ids": ["5e8a1b2c-3d4f-4a5b-9c6d-7e8f9a0b1c2d"]},
  "recording": {"enabled": true, "path": "video.mp4", "sha256": null, "locked": true},
  "runs": ["c2b9e6f4-1d3a-4c8e-9f7b-5a0d2e4c6b81"],
  "calibration": null,
  "events": [
    {
      "t_wall": "2026-10-07T18:00:10.250Z",
      "t_mono": 10.25,
      "kind": "source_lost",
      "detail": "synthetic example"
    },
    {
      "t_wall": "2026-10-07T18:00:12Z",
      "t_mono": 12.0,
      "kind": "source_recovered",
      "detail": null
    }
  ]
}
